{"$defs":{"boundaries":{"additionalProperties":false,"properties":{"autonomous_merge_authorized":{"const":false},"codex_start_authorized":{"const":false},"external_actions_authorized":{"const":false},"founder_accountability_preserved":{"const":true},"hermes_activation_authorized":{"const":false},"initial_operating_controls_activation_authorized":{"const":false},"northstar_implementation_authorized":{"const":false},"paid_services_authorized":{"const":false},"phase1_authorized":{"const":false},"production_deployment_authorized":{"const":false},"real_client_data_enabled":{"const":false},"runtime_activation_authorized":{"const":false}},"required":["codex_start_authorized","phase1_authorized","runtime_activation_authorized","hermes_activation_authorized","northstar_implementation_authorized","initial_operating_controls_activation_authorized","real_client_data_enabled","external_actions_authorized","paid_services_authorized","production_deployment_authorized","autonomous_merge_authorized","founder_accountability_preserved"],"type":"object"},"criteriaSection":{"additionalProperties":false,"properties":{"acceptance_criteria":{"items":{"$ref":"#/$defs/criterion"},"minItems":7,"type":"array"}},"required":["acceptance_criteria"],"type":"object"},"criteriaSectionWithCommands":{"additionalProperties":false,"properties":{"acceptance_criteria":{"items":{"$ref":"#/$defs/criterion"},"minItems":7,"type":"array"},"phase0_required_commands":{"items":{"type":"string"},"maxItems":15,"minItems":15,"type":"array","uniqueItems":true}},"required":["phase0_required_commands","acceptance_criteria"],"type":"object"},"criterion":{"additionalProperties":false,"properties":{"criterion":{"minLength":12,"type":"string"},"evidence_class":{"enum":["phase0_acceptance","later_implementation_acceptance","founder_manual_gate","executable_now"]},"id":{"pattern":"^[A-Z]{2}-[A-Z0-9-]+$","type":"string"}},"required":["id","criterion","evidence_class"],"type":"object"},"metric":{"additionalProperties":false,"properties":{"evidence_class":{"const":"later_implementation_acceptance"},"id":{"pattern":"^OQ-[A-Z0-9-]+$","type":"string"},"metric":{"type":"string"},"target":{"minimum":0,"type":"number"},"unit":{"enum":["percent","count"]}},"required":["id","metric","target","unit","evidence_class"],"type":"object"},"pathRecord":{"additionalProperties":false,"properties":{"path":{"type":"string"},"phase":{"type":"string"}},"required":["phase","path"],"type":"object"}},"$id":"https://offdata.local/schemas/pre-codex-readiness.schema.json","$schema":"https://json-schema.org/draft/2020-12/schema","additionalProperties":false,"properties":{"activation_conditions":{"items":{"type":"string"},"maxItems":11,"minItems":11,"type":"array","uniqueItems":true},"authority":{"additionalProperties":false,"properties":{"controlling_instruction":{"const":"AGENTS.md"},"execution_handoff":{"const":"handoff/codex-phase0-handoff.json"},"final_issue_body":{"const":"handoff/codex-phase0-issue-pcr10.md"},"final_pre_start_gate_owner":{"const":"PCR-10"},"founder_explicit_approval_required_to_start":{"const":true},"issue_is_execution_summary_not_authority":{"const":true},"pre_codex_readiness_contract":{"const":"contracts/pre-codex-readiness.json"},"prior_issue_contract":{"const":"contracts/codex-phase0-issue.json"}},"required":["controlling_instruction","execution_handoff","prior_issue_contract","pre_codex_readiness_contract","final_issue_body","final_pre_start_gate_owner","founder_explicit_approval_required_to_start","issue_is_execution_summary_not_authority"],"type":"object"},"boundaries":{"$ref":"#/$defs/boundaries"},"canonical_branch":{"const":"main"},"contract_id":{"const":"OFFDATA-PRE-CODEX-READINESS-2026-08-06"},"cross_cutting":{"$ref":"#/$defs/criteriaSection"},"developer_experience":{"$ref":"#/$defs/criteriaSectionWithCommands"},"founder_experience":{"$ref":"#/$defs/criteriaSection"},"generated_from":{"const":"configs/pre-codex-readiness.yaml"},"generated_issue":{"additionalProperties":false,"properties":{"body_character_count":{"minimum":10000,"type":"integer"},"body_line_count":{"minimum":250,"type":"integer"},"body_path":{"const":"handoff/codex-phase0-issue-pcr10.md"},"body_sha256":{"pattern":"^[0-9a-f]{64}$","type":"string"},"github_issue_sync_verified":{"const":false}},"required":["body_path","body_sha256","body_line_count","body_character_count","github_issue_sync_verified"],"type":"object"},"implementation_mapping":{"additionalProperties":false,"properties":{"executable_now":{"items":{"type":"string"},"minItems":1,"type":"array","uniqueItems":true},"founder_manual_gate":{"items":{"type":"string"},"minItems":1,"type":"array","uniqueItems":true},"later_implementation_acceptance":{"items":{"type":"string"},"minItems":1,"type":"array","uniqueItems":true},"phase0_acceptance":{"items":{"type":"string"},"minItems":1,"type":"array","uniqueItems":true}},"required":["phase0_acceptance","later_implementation_acceptance","founder_manual_gate","executable_now"],"type":"object"},"issue_extension":{"additionalProperties":false,"properties":{"base_body_path":{"const":"handoff/codex-phase0-issue.md"},"final_body_path":{"const":"handoff/codex-phase0-issue-pcr10.md"},"required_preflight_commands":{"items":{"type":"string"},"minItems":2,"type":"array","uniqueItems":true},"required_read_order_additions":{"items":{"type":"string"},"minItems":2,"type":"array","uniqueItems":true}},"required":["base_body_path","final_body_path","required_read_order_additions","required_preflight_commands"],"type":"object"},"learning_measurement":{"additionalProperties":false,"properties":{"evidence_class":{"const":"later_implementation_acceptance"},"required_fields":{"items":{"type":"string"},"minItems":11,"type":"array","uniqueItems":true}},"required":["required_fields","evidence_class"],"type":"object"},"operational_quality":{"$ref":"#/$defs/criteriaSection"},"output_quality":{"additionalProperties":false,"properties":{"artifact_surfaces":{"additionalProperties":false,"properties":{"docx":{"items":{"type":"string"},"minItems":6,"type":"array","uniqueItems":true},"pdf_svg_html":{"items":{"type":"string"},"minItems":6,"type":"array","uniqueItems":true},"pptx":{"items":{"type":"string"},"minItems":6,"type":"array","uniqueItems":true},"xlsx":{"items":{"type":"string"},"minItems":6,"type":"array","uniqueItems":true}},"required":["pptx","docx","xlsx","pdf_svg_html"],"type":"object"},"evidence":{"items":{"$ref":"#/$defs/metric"},"minItems":4,"type":"array"},"quantitative":{"items":{"$ref":"#/$defs/metric"},"minItems":4,"type":"array"}},"required":["evidence","quantitative","artifact_surfaces"],"type":"object"},"phase_id":{"const":"PCR-10"},"prior_phase_records":{"items":{"$ref":"#/$defs/pathRecord"},"minItems":3,"type":"array"},"quality_registry":{"additionalProperties":false,"properties":{"artifact_surface_count":{"const":4},"criterion_count":{"minimum":30,"type":"integer"},"criterion_ids":{"items":{"type":"string"},"minItems":30,"type":"array","uniqueItems":true},"developer_command_count":{"const":15},"learning_field_count":{"const":11}},"required":["criterion_ids","criterion_count","artifact_surface_count","developer_command_count","learning_field_count"],"type":"object"},"readiness_snapshot":{"additionalProperties":false,"properties":{"chat_first_scope_complete":{"const":true},"checks":{"additionalProperties":{"const":true},"minProperties":10,"type":"object"},"clean_macos_environment_verified":{"const":false},"codex_start_authorized":{"const":false},"explicit_founder_phase_0_approval_received":{"const":false},"issue_19_hosted_controls_verified":{"const":false},"local_prerequisites_passed":{"const":true},"next_permitted_phase_after_all_gates":{"const":"Codex Phase 0 only"},"pcr10_merge_required":{"const":false},"release_integration_complete":{"const":true}},"required":["checks","local_prerequisites_passed","chat_first_scope_complete","release_integration_complete","pcr10_merge_required","issue_19_hosted_controls_verified","clean_macos_environment_verified","explicit_founder_phase_0_approval_received","codex_start_authorized","next_permitted_phase_after_all_gates"],"type":"object"},"release_integrity":{"additionalProperties":false,"properties":{"canonical_release_requirements":{"items":{"type":"string"},"minItems":9,"type":"array","uniqueItems":true},"clean_clone_validation_required":{"const":true},"critical_or_high_defects_allowed":{"const":0},"generated_tree_must_be_clean":{"const":true},"integration_state":{"const":"integrated_to_main"}},"required":["canonical_release_requirements","integration_state","critical_or_high_defects_allowed","generated_tree_must_be_clean","clean_clone_validation_required"],"type":"object"},"repository":{"const":"rayrayxing/offdata-os"},"schema_version":{"const":"1.0.0"},"status":{"const":"chat_first_complete_integrated"},"title":{"minLength":1,"type":"string"}},"required":["schema_version","contract_id","phase_id","title","repository","canonical_branch","status","authority","activation_conditions","prior_phase_records","release_integrity","developer_experience","founder_experience","output_quality","operational_quality","learning_measurement","cross_cutting","implementation_mapping","issue_extension","boundaries","generated_from","generated_issue","readiness_snapshot","quality_registry"],"title":"offdata PCR-10 pre-Codex readiness contract","type":"object"}
