{"activation_conditions":["pcr03_merged_to_main","pcr04_merged_to_main","pcr05_merged_to_main","pcr06_merged_to_main","pcr07_merged_to_main","pcr08_merged_to_main","pcr09_merged_to_main","pcr10_merged_to_main","github_hosted_controls_in_issue_19_verified","explicit_founder_phase_0_approval_received","clean_macos_environment_available"],"authority":{"controlling_instruction":"AGENTS.md","execution_handoff":"handoff/codex-phase0-handoff.json","final_issue_body":"handoff/codex-phase0-issue-pcr10.md","final_pre_start_gate_owner":"PCR-10","founder_explicit_approval_required_to_start":true,"issue_is_execution_summary_not_authority":true,"pre_codex_readiness_contract":"contracts/pre-codex-readiness.json","prior_issue_contract":"contracts/codex-phase0-issue.json"},"boundaries":{"autonomous_merge_authorized":false,"codex_start_authorized":false,"external_actions_authorized":false,"founder_accountability_preserved":true,"hermes_activation_authorized":false,"initial_operating_controls_activation_authorized":false,"northstar_implementation_authorized":false,"paid_services_authorized":false,"phase1_authorized":false,"production_deployment_authorized":false,"real_client_data_enabled":false,"runtime_activation_authorized":false},"canonical_branch":"main","contract_id":"OFFDATA-PRE-CODEX-READINESS-2026-08-06","cross_cutting":{"acceptance_criteria":[{"criterion":"Singapore timezone and date handling are explicit and testable.","evidence_class":"phase0_acceptance","id":"XC-TIME"},{"criterion":"Currency, unit and dimension consistency are validated.","evidence_class":"later_implementation_acceptance","id":"XC-UNIT"},{"criterion":"Data export and portability do not depend on one agent or provider.","evidence_class":"later_implementation_acceptance","id":"XC-PORT"},{"criterion":"Configuration and schema migrations preserve backward compatibility or provide reviewed migration paths.","evidence_class":"phase0_acceptance","id":"XC-MIGRATE"},{"criterion":"Font availability and substitution are detected before release.","evidence_class":"later_implementation_acceptance","id":"XC-FONTS"},{"criterion":"Privacy-safe telemetry is disabled by default until explicitly approved.","evidence_class":"phase0_acceptance","id":"XC-PRIV"},{"criterion":"Material work cannot silently degrade to a lower-quality model or provider route.","evidence_class":"later_implementation_acceptance","id":"XC-MODEL"}]},"developer_experience":{"acceptance_criteria":[{"criterion":"All routine commands execute from the repository root.","evidence_class":"phase0_acceptance","id":"DX-ROOT"},{"criterion":"Failures explain cause, affected component and safe remediation.","evidence_class":"phase0_acceptance","id":"DX-DIAG"},{"criterion":"Port conflicts and unsupported versions are detected before startup.","evidence_class":"phase0_acceptance","id":"DX-PORTS"},{"criterion":"Cleanup and reset operations are path-safe and synthetic-data scoped.","evidence_class":"phase0_acceptance","id":"DX-PATH"},{"criterion":"No credential or secret value appears in command output or support bundles.","evidence_class":"phase0_acceptance","id":"DX-SECRETS"},{"criterion":"Backup and restore are demonstrable with deterministic synthetic state.","evidence_class":"phase0_acceptance","id":"DX-BACKUP"},{"criterion":"The supported macOS and Apple Silicon environment is documented and checked.","evidence_class":"phase0_acceptance","id":"DX-MAC"}],"phase0_required_commands":["doctor","bootstrap","up","down","restart","health","test","lint","format","scan","reset-synthetic","backup","restore","clean","support-bundle"]},"founder_experience":{"acceptance_criteria":[{"criterion":"Founder can identify every pending material decision in under one minute.","evidence_class":"later_implementation_acceptance","id":"FX-INBOX"},{"criterion":"Every decision shows consequence, deadline and reversibility.","evidence_class":"later_implementation_acceptance","id":"FX-CONSEQUENCE"},{"criterion":"Recommendation and authorization are visually and semantically distinct.","evidence_class":"later_implementation_acceptance","id":"FX-AUTH"},{"criterion":"Every approval previews the exact next action before execution.","evidence_class":"later_implementation_acceptance","id":"FX-PREVIEW"},{"criterion":"Material claims and numbers drill through to evidence and model outputs.","evidence_class":"later_implementation_acceptance","id":"FX-EVIDENCE"},{"criterion":"Waiting, blocked, retrying, failed, stale and complete states are distinct.","evidence_class":"later_implementation_acceptance","id":"FX-STATES"},{"criterion":"Keyboard navigation, visible focus, contrast and readable errors pass accessibility checks.","evidence_class":"later_implementation_acceptance","id":"FX-ACCESS"},{"criterion":"Client or prospect sending is impossible from an unauthorized state.","evidence_class":"later_implementation_acceptance","id":"FX-SEND"}]},"generated_from":"configs/pre-codex-readiness.yaml","generated_issue":{"body_character_count":13028,"body_line_count":287,"body_path":"handoff/codex-phase0-issue-pcr10.md","body_sha256":"01871803444487ef3e808f155a85cc13ac6fc2350eb11a401e6b5c14fc4a79ad","github_issue_sync_verified":false},"implementation_mapping":{"executable_now":["PCR-10 deterministic build","PCR-10 schema and semantic validation","retained Phase 1-7/PCR-01-10 validation"],"founder_manual_gate":["issue_19_hosted_controls","clean_macos_environment","explicit_founder_approval"],"later_implementation_acceptance":["P2","P3","P5","P6","P7","P11","P12"],"phase0_acceptance":["P0.1","P0.2","P0.3","P0.4"]},"issue_extension":{"base_body_path":"handoff/codex-phase0-issue.md","final_body_path":"handoff/codex-phase0-issue-pcr10.md","required_preflight_commands":["python scripts/build_pcr10_pre_codex_readiness.py","python scripts/validate_pcr10_pre_codex_readiness.py"],"required_read_order_additions":["docs/49-PCR-10-PRE-CODEX-RELEASE-AND-QUALITY-ACCEPTANCE.md","contracts/pre-codex-readiness.json"]},"learning_measurement":{"evidence_class":"later_implementation_acceptance","required_fields":["founder_correction_effort","recommendation_override_reason","output_editing_time","repeated_manual_task","defect_category","missing_evidence_or_method","agent_contribution_accepted_or_rejected","task_completion_time","human_time_saved","quality_per_cost","client_facing_usefulness"]},"operational_quality":{"acceptance_criteria":[{"criterion":"Structured correlation IDs connect workflow, agent, tool and artifact events.","evidence_class":"phase0_acceptance","id":"OP-CORR"},{"criterion":"Errors are classified as retryable, terminal, authorization, validation or dependency failures.","evidence_class":"phase0_acceptance","id":"OP-ERROR"},{"criterion":"Tracing is OpenTelemetry-compatible and privacy-safe by default.","evidence_class":"phase0_acceptance","id":"OP-TRACE"},{"criterion":"Health, readiness and liveness semantics are distinct and tested.","evidence_class":"phase0_acceptance","id":"OP-HEALTH"},{"criterion":"Cost, usage and latency records are attributable to model, tool and workflow.","evidence_class":"later_implementation_acceptance","id":"OP-COST"},{"criterion":"Feature flags and kill switches are visible, fail-closed and auditable.","evidence_class":"later_implementation_acceptance","id":"OP-FLAGS"},{"criterion":"Dependency provenance, license results and an SBOM are retained per release.","evidence_class":"phase0_acceptance","id":"OP-SBOM"},{"criterion":"Backup, restore, rollback and support-bundle drills are executable and documented.","evidence_class":"phase0_acceptance","id":"OP-RECOVERY"}]},"output_quality":{"artifact_surfaces":{"docx":["opens_without_repair_warning","correct_heading_navigation","controlled_pagination","no_orphaned_headings_or_broken_tables","accessible_structure_and_alt_text","citation_consistency"],"pdf_svg_html":["correct_rendering","selectable_text_where_appropriate","accessibility","responsive_html","print_safe_views","no_missing_fonts_or_assets","material_consistency_with_office_outputs"],"pptx":["opens_without_repair_warning","editable_shapes_and_charts","no_clipping_overlap_or_off_slide_content","readable_typography","template_and_brand_compliance","citations_and_notes_preserved","visual_regression_passed"],"xlsx":["formulas_remain_formulas","formula_and_reference_validation","input_assumption_output_separation","independent_recalculation","print_areas_and_named_ranges","reconciles_to_approved_deliverables"]},"evidence":[{"evidence_class":"later_implementation_acceptance","id":"OQ-CITE","metric":"material_citation_resolution_percent","target":100,"unit":"percent"},{"evidence_class":"later_implementation_acceptance","id":"OQ-CLAIM","metric":"unsupported_material_claims","target":0,"unit":"count"},{"evidence_class":"later_implementation_acceptance","id":"OQ-LABEL","metric":"fact_assumption_synthesis_recommendation_labels","target":100,"unit":"percent"},{"evidence_class":"later_implementation_acceptance","id":"OQ-CONTRA","metric":"contradicting_evidence_retained","target":100,"unit":"percent"}],"quantitative":[{"evidence_class":"later_implementation_acceptance","id":"OQ-NUM","metric":"material_number_reconciliation_percent","target":100,"unit":"percent"},{"evidence_class":"later_implementation_acceptance","id":"OQ-HARD","metric":"unexplained_hardcoded_material_numbers","target":0,"unit":"count"},{"evidence_class":"later_implementation_acceptance","id":"OQ-RECALC","metric":"independent_recalculation_pass_percent","target":100,"unit":"percent"},{"evidence_class":"later_implementation_acceptance","id":"OQ-XFMT","metric":"cross_format_material_number_agreement_percent","target":100,"unit":"percent"}]},"phase_id":"PCR-10","prior_phase_records":[{"path":"contracts/initial-operating-controls.json","phase":"PCR-08"},{"path":"contracts/codex-phase0-issue.json","phase":"PCR-09"},{"path":"handoff/codex-phase0-handoff.json","phase":"PCR-04"}],"quality_registry":{"artifact_surface_count":4,"criterion_count":38,"criterion_ids":["DX-ROOT","DX-DIA